name,starting_at,result_info,league_name,home_team,away_team,home_goals,away_goals,home_position,away_position,home_corners,away_corners,home_shots-off-target,away_shots-off-target,home_shots-total,away_shots-total,home_attacks,away_attacks,home_dangerous-attacks,away_dangerous-attacks,home_ball-possession,away_ball-possession,home_penalties,away_penalties,home_shots-insidebox,away_shots-insidebox,home_shots-outsidebox,away_shots-outsidebox,home_offsides,away_offsides,home_goals-kicks,away_goals-kicks,home_goal-attempts,away_goal-attempts,home_fouls,away_fouls,home_saves,away_saves,home_yellowcards,away_yellowcards,odds_pinnacle_home,odds_pinnacle_draw,odds_pinnacle_away,odds_btts_pinnacle_no,odds_btts_pinnacle_yes,odds_over_pinnacle_2,odds_under_pinnacle_2,odds_over_pinnacle_2_25,odds_under_pinnacle_2_25,odds_over_pinnacle_2_5,odds_under_pinnacle_2_5,odds_bet365_home,odds_bet365_draw,odds_bet365_away,odds_btts_bet365_no,odds_btts_bet365_yes,odds_over_bet365_2_0,odds_under_bet365_2_0,"odds_over_bet365_2_0, 2_5","odds_under_bet365_2_0, 2_5",odds_over_bet365_2_5,odds_under_bet365_2_5,prob_home_pinacle,prob_draw_pinacle,prob_away_pinacle,prob_btts_pinacle,prob_no_btts_pinacle,prob_over_pinnacle_2,prob_under_pinnacle_2,prob_over_pinnacle_2_25,prob_under_pinnacle_2_25,prob_over_pinnacle_2_5,prob_under_pinnacle_2_5,prob_bet365_home,prob_bet365_draw,prob_bet365_away,prob_btts_bet365_no,prob_btts_bet365_yes,prob_over_bet365_2_0,prob_under_bet365_2_0,"prob_over_bet365_2_0, 2_5","prob_under_bet365_2_0, 2_5",prob_over_bet365_2_5,prob_under_bet365_2_5,Temporada
Fagiano Okayama vs Nagoya Grampus,2026-03-01 05:00:00,Fagiano Okayama won after penalties.,Liga de Visão de 100 Anos J1,Fagiano Okayama,Nagoya Grampus,1.0,1.0,9.0,7.0,9.0,3.0,10.0,3.0,17.0,7.0,95.0,101.0,62.0,44.0,42.0,58.0,,,12.0,2.0,5.0,5.0,2.0,3.0,13.0,12.0,,,12.0,11.0,1.0,3.0,0.0,1.0,,,,,,,,,,,,3.0,2.9,2.3,1.75,2.0,1.82,1.97,,,,,,,,,,,,,,,,0.33,0.34,0.43,0.57,0.5,0.55,0.51,,,,,2026
Kawasaki Frontale vs Mito Hollyhock,2026-03-01 07:00:00,Kawasaki Frontale won after penalties.,Liga de Visão de 100 Anos J1,Kawasaki Frontale,Mito Hollyhock,2.0,2.0,6.0,7.0,6.0,2.0,5.0,2.0,15.0,10.0,144.0,77.0,69.0,29.0,64.0,36.0,1.0,0.0,8.0,7.0,7.0,3.0,2.0,1.0,9.0,11.0,,,6.0,13.0,4.0,3.0,0.0,3.0,,,,,,,,,,,,1.9,3.9,3.6,2.2,1.61,,,,,,,,,,,,,,,,,,0.53,0.26,0.28,0.45,0.62,,,,,,,2026
JEF United vs Kashiwa Reysol,2026-03-07 04:00:00,JEF United won after full-time.,Liga de Visão de 100 Anos J1,JEF United,Kashiwa Reysol,2.0,1.0,10.0,8.0,3.0,5.0,5.0,12.0,11.0,23.0,78.0,134.0,24.0,81.0,33.0,67.0,,,8.0,18.0,3.0,5.0,1.0,2.0,12.0,8.0,,,8.0,8.0,5.0,3.0,0.0,1.0,,,,,,,,,,,,4.75,3.7,1.72,1.95,1.8,,,,,1.9,1.9,,,,,,,,,,,,0.21,0.27,0.58,0.51,0.56,,,,,0.53,0.53,2026
FC Tokyo vs Yokohama F. Marinos,2026-03-07 05:00:00,FC Tokyo won after full-time.,Liga de Visão de 100 Anos J1,FC Tokyo,Yokohama F. Marinos,3.0,0.0,6.0,9.0,4.0,3.0,5.0,3.0,17.0,8.0,91.0,88.0,44.0,36.0,48.0,52.0,,,10.0,3.0,7.0,5.0,4.0,0.0,8.0,9.0,,,16.0,8.0,1.0,4.0,0.0,2.0,,,,,,,,,,,,2.05,3.3,3.6,2.05,1.7,,,,,1.97,1.82,,,,,,,,,,,,0.49,0.3,0.28,0.49,0.59,,,,,0.51,0.55,2026
Cerezo Osaka vs Shimizu S-Pulse,2026-03-07 06:00:00,Cerezo Osaka won after penalties.,Liga de Visão de 100 Anos J1,Cerezo Osaka,Shimizu S-Pulse,,,8.0,7.0,6.0,5.0,6.0,4.0,18.0,11.0,103.0,139.0,59.0,36.0,59.0,41.0,,,12.0,5.0,6.0,6.0,2.0,3.0,8.0,8.0,,,15.0,9.0,0.0,8.0,2.0,3.0,,,,,,,,,,,,2.15,3.8,3.0,2.0,1.75,,,,,1.8,2.0,,,,,,,,,,,,0.47,0.26,0.33,0.5,0.57,,,,,0.56,0.5,2026
Urawa Reds vs Mito Hollyhock,2026-03-07 06:00:00,Urawa Reds won after full-time.,Liga de Visão de 100 Anos J1,Urawa Reds,Mito Hollyhock,2.0,0.0,4.0,8.0,2.0,5.0,2.0,4.0,8.0,12.0,104.0,84.0,33.0,38.0,53.0,47.0,1.0,0.0,6.0,7.0,2.0,5.0,0.0,3.0,6.0,9.0,,,8.0,11.0,2.0,3.0,0.0,3.0,,,,,,,,,,,,1.83,3.5,4.2,1.8,1.95,,,1.85,1.95,,,,,,,,,,,,,,0.55,0.29,0.24,0.56,0.51,,,0.54,0.51,,,2026
Avispa Fukuoka vs Nagoya Grampus,2026-03-07 07:00:00,Nagoya Grampus won after full-time.,Liga de Visão de 100 Anos J1,Avispa Fukuoka,Nagoya Grampus,1.0,5.0,10.0,6.0,3.0,2.0,7.0,12.0,17.0,22.0,88.0,114.0,40.0,59.0,40.0,60.0,,,8.0,12.0,9.0,10.0,1.0,3.0,17.0,7.0,,,13.0,10.0,1.0,4.0,5.0,0.0,,,,,,,,,,,,3.7,3.4,2.0,1.66,2.1,2.02,1.77,,,,,,,,,,,,,,,,0.27,0.29,0.5,0.6,0.48,0.5,0.56,,,,,2026
Kashima Antlers vs Tokyo Verdy,2026-03-07 07:00:00,Kashima Antlers won after full-time.,Liga de Visão de 100 Anos J1,Kashima Antlers,Tokyo Verdy,2.0,0.0,1.0,3.0,6.0,5.0,5.0,1.0,12.0,3.0,116.0,77.0,37.0,34.0,54.0,46.0,1.0,0.0,6.0,1.0,6.0,2.0,1.0,1.0,6.0,7.0,,,12.0,9.0,1.0,3.0,0.0,1.0,,,,,,,,,,,,1.83,3.7,4.0,1.61,2.2,1.85,1.95,1.8,2.0,,,,,,,,,,,,,,0.55,0.27,0.25,0.62,0.45,0.54,0.51,0.56,0.5,,,2026
Fagiano Okayama vs Kyoto Sanga,2026-03-08 03:55:00,Fagiano Okayama won after full-time.,Liga de Visão de 100 Anos J1,Fagiano Okayama,Kyoto Sanga,1.0,0.0,9.0,2.0,5.0,1.0,8.0,4.0,15.0,11.0,108.0,92.0,60.0,32.0,47.0,53.0,,,10.0,5.0,5.0,6.0,1.0,4.0,5.0,10.0,,,9.0,14.0,4.0,4.0,1.0,1.0,,,,,,,,,,,,3.2,3.3,2.25,1.8,1.95,,,1.97,1.82,,,,,,,,,,,,,,0.31,0.3,0.44,0.56,0.51,,,0.51,0.55,,,2026
Gamba Osaka vs V-Varen Nagasaki,2026-03-08 06:00:00,Gamba Osaka won after full-time.,Liga de Visão de 100 Anos J1,Gamba Osaka,V-Varen Nagasaki,3.0,2.0,5.0,8.0,8.0,2.0,5.0,1.0,16.0,7.0,125.0,107.0,79.0,49.0,61.0,39.0,,,12.0,3.0,4.0,4.0,1.0,1.0,5.0,8.0,,,11.0,7.0,1.0,4.0,,,,,,,,,,,,,,2.05,3.7,3.3,2.2,1.61,,,,,1.85,1.95,,,,,,,,,,,,0.49,0.27,0.3,0.45,0.62,,,,,0.54,0.51,2026
Yokohama F. Marinos vs JEF United,2026-03-14 04:00:00,Yokohama F. Marinos won after full-time.,Liga de Visão de 100 Anos J1,Yokohama F. Marinos,JEF United,2.0,0.0,10.0,7.0,7.0,2.0,10.0,1.0,17.0,4.0,118.0,76.0,64.0,32.0,47.0,53.0,,,10.0,4.0,7.0,0.0,1.0,7.0,5.0,14.0,,,15.0,18.0,1.0,2.0,2.0,0.0,,,,,,,,,,,,2.1,3.4,3.5,2.0,1.75,,,,,1.9,1.9,,,,,,,,,,,,0.48,0.29,0.29,0.5,0.57,,,,,0.53,0.53,2026
Kyoto Sanga vs Cerezo Osaka,2026-03-14 05:00:00,Cerezo Osaka won after full-time.,Liga de Visão de 100 Anos J1,Kyoto Sanga,Cerezo Osaka,1.0,2.0,3.0,8.0,6.0,10.0,8.0,3.0,15.0,14.0,117.0,89.0,66.0,43.0,54.0,46.0,,,9.0,12.0,6.0,2.0,1.0,3.0,3.0,13.0,,,8.0,9.0,4.0,1.0,1.0,3.0,,,,,,,,,,,,2.25,3.4,3.1,2.05,1.7,,,,,2.0,1.8,,,,,,,,,,,,0.44,0.29,0.32,0.49,0.59,,,,,0.5,0.56,2026
Nagoya Grampus vs Vissel Kobe,2026-03-14 05:00:00,Vissel Kobe won after full-time.,Liga de Visão de 100 Anos J1,Nagoya Grampus,Vissel Kobe,0.0,3.0,2.0,5.0,7.0,3.0,6.0,6.0,14.0,21.0,109.0,98.0,44.0,58.0,53.0,47.0,,,8.0,13.0,6.0,8.0,2.0,3.0,11.0,11.0,,,11.0,13.0,6.0,4.0,2.0,0.0,,,,,,,,,,,,2.62,3.2,2.62,1.9,1.9,,,2.0,1.8,,,,,,,,,,,,,,0.38,0.31,0.38,0.53,0.53,,,0.5,0.56,,,2026
Shimizu S-Pulse vs Fagiano Okayama,2026-03-14 05:00:00,Shimizu S-Pulse won after penalties.,Liga de Visão de 100 Anos J1,Shimizu S-Pulse,Fagiano Okayama,1.0,1.0,7.0,6.0,7.0,7.0,8.0,5.0,19.0,13.0,147.0,48.0,82.0,32.0,62.0,38.0,,,13.0,7.0,6.0,6.0,4.0,3.0,7.0,9.0,,,5.0,10.0,4.0,5.0,0.0,1.0,,,,,,,,,,,,2.55,3.25,2.75,1.9,1.9,,,1.92,1.87,1.8,2.0,,,,,,,,,,,,0.39,0.31,0.36,0.53,0.53,,,0.52,0.53,0.56,0.5,2026
Kashiwa Reysol vs Machida Zelvia,2026-03-14 05:00:00,Machida Zelvia won after full-time.,Liga de Visão de 100 Anos J1,Kashiwa Reysol,Machida Zelvia,0.0,1.0,9.0,4.0,0.0,2.0,4.0,2.0,11.0,9.0,141.0,89.0,65.0,44.0,69.0,31.0,,,6.0,5.0,5.0,4.0,3.0,0.0,6.0,7.0,,,9.0,8.0,1.0,3.0,1.0,1.0,,,,,,,,,,,,1.95,3.4,3.9,1.8,1.95,,,1.82,1.97,,,,,,,,,,,,,,0.51,0.29,0.26,0.56,0.51,,,0.55,0.51,,,2026
Mito Hollyhock vs FC Tokyo,2026-03-14 05:00:00,FC Tokyo won after penalties.,Liga de Visão de 100 Anos J1,Mito Hollyhock,FC Tokyo,1.0,1.0,8.0,3.0,4.0,4.0,4.0,5.0,14.0,11.0,111.0,101.0,48.0,39.0,49.0,51.0,,,10.0,7.0,4.0,4.0,2.0,2.0,6.0,10.0,,,14.0,11.0,0.0,3.0,1.0,3.0,,,,,,,,,,,,3.7,3.4,2.05,1.8,1.95,,,1.92,1.87,,,,,,,,,,,,,,0.27,0.29,0.49,0.56,0.51,,,0.52,0.53,,,2026
Sanfrecce Hiroshima vs Gamba Osaka,2026-03-14 06:00:00,Sanfrecce Hiroshima won after full-time.,Liga de Visão de 100 Anos J1,Sanfrecce Hiroshima,Gamba Osaka,2.0,0.0,4.0,1.0,10.0,3.0,11.0,2.0,20.0,6.0,102.0,96.0,75.0,25.0,51.0,49.0,,,15.0,5.0,5.0,1.0,4.0,0.0,3.0,11.0,,,10.0,17.0,2.0,2.0,2.0,4.0,,,,,,,,,,,,1.7,3.8,4.5,2.0,1.75,,,,,,,,,,,,,,,,,,0.59,0.26,0.22,0.5,0.57,,,,,,,2026
Kashima Antlers vs Kawasaki Frontale,2026-03-14 06:00:00,Kashima Antlers won after full-time.,Liga de Visão de 100 Anos J1,Kashima Antlers,Kawasaki Frontale,1.0,0.0,1.0,6.0,6.0,2.0,4.0,6.0,16.0,13.0,91.0,113.0,42.0,68.0,52.0,48.0,,,11.0,9.0,5.0,4.0,,,12.0,4.0,,,13.0,9.0,2.0,5.0,1.0,0.0,,,,,,,,,,,,1.95,3.6,3.7,2.2,1.61,,,,,,,,,,,,,,,,,,0.51,0.28,0.27,0.45,0.62,,,,,,,2026
Tokyo Verdy vs Urawa Reds,2026-03-14 07:00:00,Tokyo Verdy won after full-time.,Liga de Visão de 100 Anos J1,Tokyo Verdy,Urawa Reds,1.0,0.0,5.0,3.0,2.0,6.0,9.0,8.0,14.0,15.0,81.0,144.0,49.0,69.0,31.0,69.0,,,10.0,9.0,4.0,6.0,1.0,2.0,11.0,13.0,,,11.0,12.0,4.0,2.0,1.0,2.0,,,,,,,,,,,,3.9,3.1,2.1,1.61,2.2,1.87,1.92,,,,,,,,,,,,,,,,0.26,0.32,0.48,0.62,0.45,0.53,0.52,,,,,2026
V-Varen Nagasaki vs Avispa Fukuoka,2026-03-15 05:00:00,V-Varen Nagasaki won after full-time.,Liga de Visão de 100 Anos J1,V-Varen Nagasaki,Avispa Fukuoka,1.0,0.0,9.0,10.0,7.0,3.0,6.0,3.0,13.0,11.0,101.0,82.0,40.0,30.0,60.0,40.0,1.0,0.0,9.0,8.0,4.0,3.0,1.0,3.0,8.0,11.0,,,7.0,9.0,3.0,2.0,1.0,0.0,,,,,,,,,,,,2.05,3.3,3.7,1.9,1.9,,,1.82,1.97,,,,,,,,,,,,,,0.49,0.3,0.27,0.53,0.53,,,0.55,0.51,,,2026
Cerezo Osaka vs Fagiano Okayama,2026-03-18 09:30:00,Fagiano Okayama won after full-time.,Liga de Visão de 100 Anos J1,Cerezo Osaka,Fagiano Okayama,1.0,2.0,5.0,8.0,2.0,4.0,3.0,3.0,7.0,11.0,117.0,83.0,88.0,49.0,55.0,45.0,,,3.0,4.0,4.0,7.0,2.0,4.0,15.0,7.0,,,13.0,13.0,2.0,2.0,0.0,2.0,,,,,,,,,,,,1.95,3.5,3.7,1.95,1.8,,,1.97,1.82,2.0,1.8,,,,,,,,,,,,0.51,0.29,0.27,0.51,0.56,,,0.51,0.55,0.5,0.56,2026
V-Varen Nagasaki vs Kyoto Sanga,2026-03-18 10:00:00,Kyoto Sanga won after full-time.,Liga de Visão de 100 Anos J1,V-Varen Nagasaki,Kyoto Sanga,1.0,2.0,7.0,4.0,1.0,3.0,5.0,7.0,12.0,14.0,97.0,114.0,34.0,44.0,46.0,54.0,,,9.0,10.0,3.0,4.0,0.0,2.0,9.0,5.0,,,6.0,11.0,2.0,1.0,0.0,2.0,,,,,,,,,,,,2.8,3.4,2.5,2.05,1.7,,,,,1.95,1.85,,,,,,,,,,,,0.36,0.29,0.4,0.49,0.59,,,,,0.51,0.54,2026
Avispa Fukuoka vs Shimizu S-Pulse,2026-03-18 10:00:00,Shimizu S-Pulse won after penalties.,Liga de Visão de 100 Anos J1,Avispa Fukuoka,Shimizu S-Pulse,1.0,1.0,10.0,9.0,5.0,2.0,3.0,2.0,13.0,7.0,106.0,113.0,74.0,45.0,53.0,47.0,,,5.0,6.0,8.0,1.0,4.0,5.0,2.0,3.0,,,7.0,10.0,1.0,1.0,2.0,1.0,,,,,,,,,,,,3.0,3.3,2.35,1.9,1.9,,,1.9,1.9,,,,,,,,,,,,,,0.33,0.3,0.43,0.53,0.53,,,0.53,0.53,,,2026
Vissel Kobe vs Gamba Osaka,2026-03-18 10:00:00,Gamba Osaka won after penalties.,Liga de Visão de 100 Anos J1,Vissel Kobe,Gamba Osaka,2.0,2.0,1.0,3.0,6.0,3.0,9.0,4.0,15.0,14.0,96.0,103.0,45.0,50.0,45.0,55.0,,,14.0,9.0,1.0,5.0,1.0,4.0,7.0,4.0,,,7.0,19.0,6.0,1.0,1.0,1.0,,,,,,,,,,,,1.9,3.6,3.9,1.9,1.9,,,,,1.87,1.92,,,,,,,,,,,,0.53,0.28,0.26,0.53,0.53,,,,,0.53,0.52,2026
Nagoya Grampus vs Sanfrecce Hiroshima,2026-03-18 10:00:00,Nagoya Grampus won after full-time.,Liga de Visão de 100 Anos J1,Nagoya Grampus,Sanfrecce Hiroshima,2.0,1.0,6.0,2.0,7.0,5.0,3.0,10.0,13.0,17.0,94.0,125.0,36.0,67.0,44.0,56.0,,,12.0,11.0,1.0,6.0,1.0,0.0,11.0,6.0,,,5.0,11.0,2.0,5.0,1.0,2.0,,,,,,,,,,,,3.4,3.7,2.0,2.0,1.75,,,,,2.0,1.8,,,,,,,,,,,,0.29,0.27,0.5,0.5,0.57,,,,,0.5,0.56,2026
Tokyo Verdy vs Kawasaki Frontale,2026-03-18 10:00:00,Kawasaki Frontale won after full-time.,Liga de Visão de 100 Anos J1,Tokyo Verdy,Kawasaki Frontale,0.0,2.0,4.0,6.0,7.0,6.0,4.0,3.0,9.0,8.0,100.0,96.0,49.0,38.0,57.0,43.0,,,8.0,6.0,1.0,2.0,3.0,2.0,5.0,7.0,,,9.0,11.0,3.0,1.0,2.0,2.0,,,,,,,,,,,,3.6,3.4,2.0,2.0,1.75,,,,,2.02,1.77,,,,,,,,,,,,0.28,0.29,0.5,0.5,0.57,,,,,0.5,0.56,2026
JEF United vs FC Tokyo,2026-03-18 10:00:00,FC Tokyo won after full-time.,Liga de Visão de 100 Anos J1,JEF United,FC Tokyo,1.0,2.0,9.0,3.0,5.0,8.0,5.0,7.0,11.0,25.0,98.0,104.0,23.0,64.0,46.0,54.0,0.0,1.0,6.0,14.0,5.0,11.0,1.0,2.0,10.0,6.0,,,10.0,9.0,8.0,2.0,1.0,1.0,,,,,,,,,,,,4.33,3.6,1.8,1.95,1.8,,,,,1.97,1.82,,,,,,,,,,,,0.23,0.28,0.56,0.51,0.56,,,,,0.51,0.55,2026
Mito Hollyhock vs Yokohama F. Marinos,2026-03-18 10:00:00,Mito Hollyhock won after full-time.,Liga de Visão de 100 Anos J1,Mito Hollyhock,Yokohama F. Marinos,1.0,0.0,8.0,7.0,3.0,4.0,5.0,3.0,15.0,5.0,126.0,104.0,66.0,28.0,66.0,34.0,,,9.0,3.0,6.0,2.0,0.0,3.0,4.0,10.0,,,11.0,10.0,1.0,1.0,1.0,0.0,,,,,,,,,,,,2.25,3.25,3.25,1.9,1.9,,,1.8,2.0,,,,,,,,,,,,,,0.44,0.31,0.31,0.53,0.53,,,0.56,0.5,,,2026
Machida Zelvia vs Kashima Antlers,2026-03-18 10:30:00,Kashima Antlers won after full-time.,Liga de Visão de 100 Anos J1,Machida Zelvia,Kashima Antlers,0.0,3.0,2.0,1.0,7.0,3.0,8.0,4.0,16.0,10.0,81.0,82.0,42.0,24.0,45.0,55.0,,,11.0,8.0,5.0,2.0,1.0,2.0,5.0,13.0,,,12.0,9.0,2.0,3.0,2.0,0.0,,,,,,,,,,,,2.37,3.1,3.1,1.7,2.05,1.85,1.95,1.85,1.95,,,,,,,,,,,,,,0.42,0.32,0.32,0.59,0.49,0.54,0.51,0.54,0.51,,,2026
Urawa Reds vs Kashiwa Reysol,2026-03-18 10:30:00,Kashiwa Reysol won after penalties.,Liga de Visão de 100 Anos J1,Urawa Reds,Kashiwa Reysol,1.0,1.0,5.0,10.0,4.0,7.0,6.0,6.0,13.0,15.0,92.0,112.0,33.0,52.0,39.0,61.0,,,8.0,9.0,5.0,6.0,0.0,1.0,6.0,7.0,,,7.0,10.0,3.0,3.0,0.0,1.0,,,,,,,,,,,,3.2,3.4,2.2,2.0,1.75,,,,,2.02,1.77,,,,,,,,,,,,0.31,0.29,0.45,0.5,0.57,,,,,0.5,0.56,2026
Fagiano Okayama vs V-Varen Nagasaki,2026-03-21 05:00:00,V-Varen Nagasaki won after full-time.,Liga de Visão de 100 Anos J1,Fagiano Okayama,V-Varen Nagasaki,0.0,1.0,6.0,9.0,5.0,5.0,8.0,3.0,12.0,9.0,108.0,91.0,60.0,38.0,55.0,45.0,,,7.0,8.0,5.0,1.0,1.0,2.0,5.0,17.0,,,10.0,7.0,3.0,2.0,1.0,0.0,,,,,,,,,,,,2.3,3.1,3.3,1.9,1.9,,,1.77,2.02,2.05,1.75,,,,,,,,,,,,0.43,0.32,0.3,0.53,0.53,,,0.56,0.5,0.49,0.57,2026
Avispa Fukuoka vs Gamba Osaka,2026-03-21 05:30:00,Avispa Fukuoka won after penalties.,Liga de Visão de 100 Anos J1,Avispa Fukuoka,Gamba Osaka,2.0,2.0,10.0,1.0,4.0,1.0,9.0,2.0,20.0,6.0,107.0,72.0,50.0,17.0,49.0,51.0,1.0,0.0,13.0,2.0,7.0,4.0,3.0,3.0,7.0,13.0,,,13.0,10.0,2.0,5.0,1.0,1.0,,,,,,,,,,,,4.2,3.25,1.9,1.8,1.95,,,1.9,1.9,,,,,,,,,,,,,,0.24,0.31,0.53,0.56,0.51,,,0.53,0.53,,,2026
Shimizu S-Pulse vs Sanfrecce Hiroshima,2026-03-22 04:00:00,Shimizu S-Pulse won after full-time.,Liga de Visão de 100 Anos J1,Shimizu S-Pulse,Sanfrecce Hiroshima,3.0,1.0,8.0,6.0,4.0,5.0,5.0,3.0,12.0,15.0,119.0,108.0,45.0,51.0,45.0,55.0,,,9.0,12.0,3.0,3.0,0.0,3.0,6.0,11.0,,,12.0,9.0,4.0,3.0,0.0,1.0,,,,,,,,,,,,4.33,3.25,1.9,2.0,1.75,,,,,1.9,1.9,,,,,,,,,,,,0.23,0.31,0.53,0.5,0.57,,,,,0.53,0.53,2026
Kyoto Sanga vs Nagoya Grampus,2026-03-22 05:00:00,Kyoto Sanga won after penalties.,Liga de Visão de 100 Anos J1,Kyoto Sanga,Nagoya Grampus,1.0,1.0,3.0,4.0,9.0,7.0,7.0,6.0,21.0,16.0,75.0,99.0,45.0,66.0,46.0,54.0,,,9.0,10.0,12.0,6.0,0.0,1.0,7.0,14.0,,,12.0,9.0,3.0,6.0,3.0,0.0,,,,,,,,,,,,2.6,3.25,2.7,2.05,1.7,,,,,1.92,1.87,,,,,,,,,,,,0.38,0.31,0.37,0.49,0.59,,,,,0.52,0.53,2026
Tokyo Verdy vs FC Tokyo,2026-03-22 05:00:00,Tokyo Verdy won after penalties.,Liga de Visão de 100 Anos J1,Tokyo Verdy,FC Tokyo,,,5.0,2.0,6.0,2.0,4.0,3.0,9.0,7.0,83.0,101.0,33.0,31.0,36.0,64.0,,,4.0,5.0,5.0,2.0,3.0,1.0,10.0,8.0,,,6.0,4.0,1.0,2.0,2.0,1.0,,,,,,,,,,,,4.33,3.1,1.95,1.61,2.2,1.97,1.82,,,,,,,,,,,,,,,,0.23,0.32,0.51,0.62,0.45,0.51,0.55,,,,,2026
Kawasaki Frontale vs Yokohama F. Marinos,2026-03-22 06:00:00,Yokohama F. Marinos won after full-time.,Liga de Visão de 100 Anos J1,Kawasaki Frontale,Yokohama F. Marinos,0.0,5.0,6.0,8.0,7.0,5.0,4.0,5.0,11.0,15.0,99.0,75.0,52.0,22.0,68.0,32.0,,,11.0,13.0,0.0,2.0,7.0,2.0,7.0,12.0,,,15.0,12.0,3.0,3.0,0.0,1.0,,,,,,,,,,,,2.15,3.4,3.25,2.5,1.5,,,,,,,,,,,,,,,,,,0.47,0.29,0.31,0.4,0.67,,,,,,,2026
Cerezo Osaka vs Vissel Kobe,2026-03-22 06:00:00,Cerezo Osaka won after penalties.,Liga de Visão de 100 Anos J1,Cerezo Osaka,Vissel Kobe,1.0,1.0,9.0,2.0,8.0,7.0,3.0,7.0,7.0,11.0,89.0,119.0,44.0,53.0,50.0,50.0,,,4.0,2.0,3.0,9.0,0.0,3.0,14.0,7.0,,,10.0,7.0,0.0,2.0,1.0,2.0,,,,,,,,,,,,2.7,3.25,2.6,2.0,1.75,,,,,1.97,1.82,,,,,,,,,,,,0.37,0.31,0.38,0.5,0.57,,,,,0.51,0.55,2026
Kashima Antlers vs JEF United,2026-03-22 06:00:00,Kashima Antlers won after full-time.,Liga de Visão de 100 Anos J1,Kashima Antlers,JEF United,2.0,1.0,1.0,10.0,10.0,4.0,8.0,5.0,18.0,10.0,113.0,78.0,45.0,47.0,66.0,34.0,,,13.0,5.0,5.0,5.0,,,8.0,9.0,,,8.0,14.0,1.0,2.0,1.0,1.0,,,,,,,,,,,,1.5,3.9,7.0,1.8,1.95,,,,,1.85,1.95,,,,,,,,,,,,0.67,0.26,0.14,0.56,0.51,,,,,0.54,0.51,2026
Kashiwa Reysol vs Mito Hollyhock,2026-03-22 07:00:00,Kashiwa Reysol won after full-time.,Liga de Visão de 100 Anos J1,Kashiwa Reysol,Mito Hollyhock,3.0,0.0,9.0,7.0,4.0,3.0,4.0,4.0,17.0,8.0,104.0,101.0,42.0,39.0,52.0,48.0,,,15.0,3.0,2.0,5.0,1.0,0.0,10.0,1.0,,,4.0,6.0,0.0,3.0,0.0,3.0,,,,,,,,,,,,1.53,3.7,7.0,1.9,1.9,,,,,1.87,1.92,,,,,,,,,,,,0.65,0.27,0.14,0.53,0.53,,,,,0.53,0.52,2026
Urawa Reds vs Machida Zelvia,2026-03-22 07:00:00,Machida Zelvia won after full-time.,Liga de Visão de 100 Anos J1,Urawa Reds,Machida Zelvia,1.0,2.0,4.0,3.0,6.0,2.0,8.0,7.0,19.0,15.0,107.0,107.0,41.0,53.0,52.0,48.0,0.0,1.0,9.0,10.0,10.0,5.0,0.0,1.0,10.0,11.0,,,7.0,8.0,4.0,5.0,2.0,2.0,,,,,,,,,,,,2.87,3.0,2.6,1.95,1.8,,,2.05,1.75,,,,,,,,,,,,,,0.35,0.33,0.38,0.51,0.56,,,0.49,0.57,,,2026
